{
  "schema": "animation.v1",
  "id": "fsa.animation.arms.throw",
  "rig": "humanoid.v1",
  "duration": 0.85,
  "loop": false,
  "mode": "timeline",
  "tracks": {
    "Arm_L": [
      {
        "time": 0,
        "rotation": [
          0,
          0,
          -90
        ]
      },
      {
        "time": 0.28,
        "rotation": [
          0,
          0,
          -75
        ]
      },
      {
        "time": 0.45,
        "rotation": [
          0,
          0,
          -75
        ]
      },
      {
        "time": 0.85,
        "rotation": [
          0,
          0,
          -90
        ]
      }
    ],
    "Arm_R": [
      {
        "time": 0,
        "rotation": [
          0,
          0,
          90
        ]
      },
      {
        "time": 0.28,
        "rotation": [
          -135,
          0,
          65
        ]
      },
      {
        "time": 0.45,
        "rotation": [
          -65,
          0,
          75
        ]
      },
      {
        "time": 0.85,
        "rotation": [
          0,
          0,
          90
        ]
      }
    ]
  }
}
