{
  "schema": "animation.v1",
  "id": "fsa.animation.arms.empty_idle",
  "rig": "humanoid.v1",
  "duration": 2.4,
  "loop": true,
  "mode": "timeline",
  "tracks": {
    "Arm_L": [
      {
        "time": 0,
        "rotation": [
          0,
          0,
          -90
        ]
      },
      {
        "time": 0.075,
        "rotation": [
          0.19509032201612825,
          0,
          -90
        ]
      },
      {
        "time": 0.15,
        "rotation": [
          0.3826834323650898,
          0,
          -90
        ]
      },
      {
        "time": 0.225,
        "rotation": [
          0.5555702330196022,
          0,
          -90
        ]
      },
      {
        "time": 0.3,
        "rotation": [
          0.7071067811865475,
          0,
          -90
        ]
      },
      {
        "time": 0.375,
        "rotation": [
          0.8314696123025452,
          0,
          -90
        ]
      },
      {
        "time": 0.45,
        "rotation": [
          0.9238795325112867,
          0,
          -90
        ]
      },
      {
        "time": 0.525,
        "rotation": [
          0.9807852804032304,
          0,
          -90
        ]
      },
      {
        "time": 0.6,
        "rotation": [
          1,
          0,
          -90
        ]
      },
      {
        "time": 0.675,
        "rotation": [
          0.9807852804032304,
          0,
          -90
        ]
      },
      {
        "time": 0.75,
        "rotation": [
          0.9238795325112867,
          0,
          -90
        ]
      },
      {
        "time": 0.825,
        "rotation": [
          0.8314696123025453,
          0,
          -90
        ]
      },
      {
        "time": 0.9,
        "rotation": [
          0.7071067811865476,
          0,
          -90
        ]
      },
      {
        "time": 0.975,
        "rotation": [
          0.5555702330196022,
          0,
          -90
        ]
      },
      {
        "time": 1.05,
        "rotation": [
          0.3826834323650899,
          0,
          -90
        ]
      },
      {
        "time": 1.125,
        "rotation": [
          0.1950903220161286,
          0,
          -90
        ]
      },
      {
        "time": 1.2,
        "rotation": [
          1.2246467991473532e-16,
          0,
          -90
        ]
      },
      {
        "time": 1.275,
        "rotation": [
          -0.19509032201612836,
          0,
          -90
        ]
      },
      {
        "time": 1.35,
        "rotation": [
          -0.38268343236508967,
          0,
          -90
        ]
      },
      {
        "time": 1.425,
        "rotation": [
          -0.555570233019602,
          0,
          -90
        ]
      },
      {
        "time": 1.5,
        "rotation": [
          -0.7071067811865475,
          0,
          -90
        ]
      },
      {
        "time": 1.575,
        "rotation": [
          -0.8314696123025452,
          0,
          -90
        ]
      },
      {
        "time": 1.65,
        "rotation": [
          -0.9238795325112865,
          0,
          -90
        ]
      },
      {
        "time": 1.725,
        "rotation": [
          -0.9807852804032303,
          0,
          -90
        ]
      },
      {
        "time": 1.8,
        "rotation": [
          -1,
          0,
          -90
        ]
      },
      {
        "time": 1.875,
        "rotation": [
          -0.9807852804032304,
          0,
          -90
        ]
      },
      {
        "time": 1.95,
        "rotation": [
          -0.9238795325112866,
          0,
          -90
        ]
      },
      {
        "time": 2.025,
        "rotation": [
          -0.8314696123025455,
          0,
          -90
        ]
      },
      {
        "time": 2.1,
        "rotation": [
          -0.7071067811865477,
          0,
          -90
        ]
      },
      {
        "time": 2.175,
        "rotation": [
          -0.5555702330196022,
          0,
          -90
        ]
      },
      {
        "time": 2.25,
        "rotation": [
          -0.3826834323650904,
          0,
          -90
        ]
      },
      {
        "time": 2.325,
        "rotation": [
          -0.19509032201612872,
          0,
          -90
        ]
      },
      {
        "time": 2.4,
        "rotation": [
          0,
          0,
          -90
        ]
      }
    ],
    "Arm_R": [
      {
        "time": 0,
        "rotation": [
          0,
          0,
          90
        ]
      },
      {
        "time": 0.075,
        "rotation": [
          -0.19509032201612825,
          0,
          90
        ]
      },
      {
        "time": 0.15,
        "rotation": [
          -0.3826834323650898,
          0,
          90
        ]
      },
      {
        "time": 0.225,
        "rotation": [
          -0.5555702330196022,
          0,
          90
        ]
      },
      {
        "time": 0.3,
        "rotation": [
          -0.7071067811865475,
          0,
          90
        ]
      },
      {
        "time": 0.375,
        "rotation": [
          -0.8314696123025452,
          0,
          90
        ]
      },
      {
        "time": 0.45,
        "rotation": [
          -0.9238795325112867,
          0,
          90
        ]
      },
      {
        "time": 0.525,
        "rotation": [
          -0.9807852804032304,
          0,
          90
        ]
      },
      {
        "time": 0.6,
        "rotation": [
          -1,
          0,
          90
        ]
      },
      {
        "time": 0.675,
        "rotation": [
          -0.9807852804032304,
          0,
          90
        ]
      },
      {
        "time": 0.75,
        "rotation": [
          -0.9238795325112867,
          0,
          90
        ]
      },
      {
        "time": 0.825,
        "rotation": [
          -0.8314696123025453,
          0,
          90
        ]
      },
      {
        "time": 0.9,
        "rotation": [
          -0.7071067811865476,
          0,
          90
        ]
      },
      {
        "time": 0.975,
        "rotation": [
          -0.5555702330196022,
          0,
          90
        ]
      },
      {
        "time": 1.05,
        "rotation": [
          -0.3826834323650899,
          0,
          90
        ]
      },
      {
        "time": 1.125,
        "rotation": [
          -0.1950903220161286,
          0,
          90
        ]
      },
      {
        "time": 1.2,
        "rotation": [
          -1.2246467991473532e-16,
          0,
          90
        ]
      },
      {
        "time": 1.275,
        "rotation": [
          0.19509032201612836,
          0,
          90
        ]
      },
      {
        "time": 1.35,
        "rotation": [
          0.38268343236508967,
          0,
          90
        ]
      },
      {
        "time": 1.425,
        "rotation": [
          0.555570233019602,
          0,
          90
        ]
      },
      {
        "time": 1.5,
        "rotation": [
          0.7071067811865475,
          0,
          90
        ]
      },
      {
        "time": 1.575,
        "rotation": [
          0.8314696123025452,
          0,
          90
        ]
      },
      {
        "time": 1.65,
        "rotation": [
          0.9238795325112865,
          0,
          90
        ]
      },
      {
        "time": 1.725,
        "rotation": [
          0.9807852804032303,
          0,
          90
        ]
      },
      {
        "time": 1.8,
        "rotation": [
          1,
          0,
          90
        ]
      },
      {
        "time": 1.875,
        "rotation": [
          0.9807852804032304,
          0,
          90
        ]
      },
      {
        "time": 1.95,
        "rotation": [
          0.9238795325112866,
          0,
          90
        ]
      },
      {
        "time": 2.025,
        "rotation": [
          0.8314696123025455,
          0,
          90
        ]
      },
      {
        "time": 2.1,
        "rotation": [
          0.7071067811865477,
          0,
          90
        ]
      },
      {
        "time": 2.175,
        "rotation": [
          0.5555702330196022,
          0,
          90
        ]
      },
      {
        "time": 2.25,
        "rotation": [
          0.3826834323650904,
          0,
          90
        ]
      },
      {
        "time": 2.325,
        "rotation": [
          0.19509032201612872,
          0,
          90
        ]
      },
      {
        "time": 2.4,
        "rotation": [
          0,
          0,
          90
        ]
      }
    ]
  }
}
