{
  "schema": "animation.v1",
  "id": "FSA_ANIM_Character_Hit",
  "rig": "humanoid.v1",
  "mode": "timeline",
  "duration": 0.65,
  "loop": false,
  "tracks": {
    "Root": [
      {
        "time": 0,
        "rotation": [
          0,
          0,
          0
        ]
      },
      {
        "time": 0.13,
        "rotation": [
          0,
          0,
          0
        ]
      },
      {
        "time": 0.3,
        "rotation": [
          0,
          0,
          0
        ]
      },
      {
        "time": 0.65,
        "rotation": [
          0,
          0,
          0
        ]
      }
    ],
    "Body": [
      {
        "time": 0,
        "rotation": [
          2,
          0,
          0
        ],
        "position": [
          0,
          0,
          0
        ]
      },
      {
        "time": 0.13,
        "rotation": [
          2,
          0,
          0
        ],
        "position": [
          0,
          0,
          0
        ]
      },
      {
        "time": 0.3,
        "rotation": [
          2,
          0,
          0
        ],
        "position": [
          0,
          0,
          0
        ]
      },
      {
        "time": 0.65,
        "rotation": [
          2,
          0,
          0
        ],
        "position": [
          0,
          0,
          0
        ]
      }
    ],
    "Head": [
      {
        "time": 0,
        "rotation": [
          0,
          0,
          0
        ]
      },
      {
        "time": 0.13,
        "rotation": [
          -13,
          0,
          5
        ]
      },
      {
        "time": 0.3,
        "rotation": [
          5,
          0,
          0
        ]
      },
      {
        "time": 0.65,
        "rotation": [
          0,
          0,
          0
        ]
      }
    ],
    "Arm_L": [
      {
        "time": 0,
        "rotation": [
          0,
          0,
          -90
        ]
      },
      {
        "time": 0.13,
        "rotation": [
          -18,
          0,
          -78
        ]
      },
      {
        "time": 0.3,
        "rotation": [
          0,
          0,
          -90
        ]
      },
      {
        "time": 0.65,
        "rotation": [
          0,
          0,
          -90
        ]
      }
    ],
    "Arm_R": [
      {
        "time": 0,
        "rotation": [
          0,
          0,
          90
        ]
      },
      {
        "time": 0.13,
        "rotation": [
          -24,
          0,
          77
        ]
      },
      {
        "time": 0.3,
        "rotation": [
          0,
          0,
          90
        ]
      },
      {
        "time": 0.65,
        "rotation": [
          0,
          0,
          90
        ]
      }
    ],
    "Leg_L": [
      {
        "time": 0,
        "rotation": [
          0,
          0,
          0
        ]
      },
      {
        "time": 0.13,
        "rotation": [
          0,
          0,
          0
        ]
      },
      {
        "time": 0.3,
        "rotation": [
          0,
          0,
          0
        ]
      },
      {
        "time": 0.65,
        "rotation": [
          0,
          0,
          0
        ]
      }
    ],
    "Leg_R": [
      {
        "time": 0,
        "rotation": [
          0,
          0,
          0
        ]
      },
      {
        "time": 0.13,
        "rotation": [
          0,
          0,
          0
        ]
      },
      {
        "time": 0.3,
        "rotation": [
          0,
          0,
          0
        ]
      },
      {
        "time": 0.65,
        "rotation": [
          0,
          0,
          0
        ]
      }
    ]
  }
}
